{
  "arithmetic": "Exact rational arithmetic: no binary floating point. + - * / and integer powers are exact, and so is every unit conversion. A value whose decimal ends (at most 40 significant digits) is written exactly; any other is written rounded half-even to 30 significant digits, and its exact value is given beside it as a fraction. Comparisons use exact values.",
  "content_hash": "sha256:8920a694693035cee3a8f6f4a4ab87ee36bfa42324a4f787af99988ded34d643",
  "graph": {
    "nodes": [
      {
        "id": "ratio",
        "source": {
          "design": "83d2b0775fe79af6",
          "design_node": "con:gain-per-stage"
        },
        "value": "1234567/1000000"
      },
      {
        "args": [
          "ratio",
          "ratio"
        ],
        "id": "r2",
        "op": "mul"
      },
      {
        "args": [
          "r2",
          "r2"
        ],
        "id": "r4",
        "op": "mul"
      },
      {
        "args": [
          "r4",
          "r4"
        ],
        "id": "r8",
        "op": "mul"
      },
      {
        "args": [
          "r8",
          "r8"
        ],
        "id": "r16",
        "op": "mul"
      },
      {
        "args": [
          "r16",
          "r16"
        ],
        "id": "r32",
        "op": "mul"
      },
      {
        "args": [
          "r32",
          "r32"
        ],
        "id": "r64",
        "op": "mul"
      },
      {
        "id": "limit",
        "source": "requirement: the gain stays under a million",
        "value": "1e6"
      },
      {
        "args": [
          "r64",
          "limit"
        ],
        "id": "under",
        "op": "lt"
      }
    ],
    "result": "under"
  },
  "inputs": [
    {
      "id": "ratio",
      "source": {
        "design": "83d2b0775fe79af6",
        "design_node": "con:gain-per-stage"
      },
      "unit": "",
      "value": "1.234567"
    },
    {
      "id": "limit",
      "source": "requirement: the gain stays under a million",
      "unit": "",
      "value": "1000000"
    }
  ],
  "name": "stage-gain",
  "produced_by": {
    "flo2_calc": "0.2.0",
    "pint": "0.26.1"
  },
  "record_format": "flo2-calc computation record",
  "result": {
    "node": "under",
    "value": "true"
  },
  "schema_version": 2,
  "status": "computed",
  "supports": {
    "design_node": "dec:stage-count"
  },
  "values": [
    {
      "node": "ratio",
      "value": "1.234567"
    },
    {
      "node": "r2",
      "value": "1.524155677489"
    },
    {
      "node": "r4",
      "value": "2.323050529221952581345121"
    },
    {
      "exact": "5396563761318393964062660689603780554533710504641/1000000000000000000000000000000000000000000000000",
      "node": "r8",
      "value": "5.3965637613183939640626606896"
    },
    {
      "exact": "29122900429974931777464756737861598045089981646731119680472496479775720479918372004992150882538881/1000000000000000000000000000000000000000000000000000000000000000000000000000000000000000000000000",
      "node": "r16",
      "value": "29.1229004299749317774647567379"
    },
    {
      "exact": "848143329454234066202298685037610938453801436436082061605481083484040247807038342932049024616705226605937314147222575598657851884480316076770053342897698193439968216407562877497728443176476732161/1000000000000000000000000000000000000000000000000000000000000000000000000000000000000000000000000000000000000000000000000000000000000000000000000000000000000000000000000000000000000000000000000",
      "node": "r32",
      "value": "848.143329454234066202298685038"
    },
    {
      "exact": "719347107297713427314376575258917927637142042975599541935570339866438563980083209785896988865125851441367031016218843600023088394528031593561606574438464017458115665763264244522466246785076753947054843299405302726893104052762982513786243633070703043853496150460758400787626846193281998835641312812261629277889040175884136570789497739198302766801453953975344065070401673589147640225331729921/1000000000000000000000000000000000000000000000000000000000000000000000000000000000000000000000000000000000000000000000000000000000000000000000000000000000000000000000000000000000000000000000000000000000000000000000000000000000000000000000000000000000000000000000000000000000000000000000000000000000000000000000000000000000000000000000000000000000000000000000000000000000000000000000000",
      "node": "r64",
      "value": "719347.107297713427314376575259"
    },
    {
      "node": "limit",
      "value": "1000000"
    },
    {
      "node": "under",
      "value": "true"
    }
  ]
}
